S/N,QUESTION,OPTION1,OPTION2,OPTION3,OPTION4,ANSWER
1,"A son honoureth his father, and a servant his master: if then I be a father, where is mine honour? And if I be a master, where is my fear? Saith the Lord of hosts unto you, O priests, that despise my name. And ye say, Wherein have we despised thy name?",MALACHI 1:6,MALACHI 2:16,MALACHI 3:6,MALACHI 3:8,1
2,"For the Lord, the God of Israel, saith that he hateth puttin away: for one covereth violence with his garment, saith the Lord of hosts: therefore take heed to your spirit, that ye deal not treacherously.",MALACHI 1:6,MALACHI 2:16,MALACHI 3:6,MALACHI 3:8,2
3,"For I am the Lord, I change not; therefore ye sons of Jacob are not consumed.",MALACHI 3:6,MALACHI 3:8,MALACHI 3:10,MALACHI 3:11,1
4,"Will a man rob God? Yet ye have robbed me. But ye say, Wherein have we robbed thee? In tithes and offerings.",MALACHI 3:6,MALACHI 3:8,MALACHI 3:10,MALACHI 3:11,2
5,"Bring ye all the tithes into the storehouse, that there may be meat in mine house, and prove me now herewith, saith the Lord of hosts, if I will not open you the windows of heaven, and pour you out a blessing, that there shall not be room enough to receive it.",MALACHI 3:6,MALACHI 3:8,MALACHI 3:10,MALACHI 3:11,3
6,"And I will rebuke the devourer for your sakes, and he shall not destry the fruits of your ground; neither shall your vine cast her fruit before the time in the field, saith the Lord of hosts.",MALACHI 3:10,MALACHI 3:11,MALACHI 3:12,MALACHI 3:13,2
7,"And all nations shall call you blessed: for ye shall be a delightsome land, saith the Lord of hosts.",MALACHI 3:10,MALACHI 3:11,MALACHI 3:12,MALACHI 3:13,3