S/N,QUESTION,OPTION1,OPTION2,OPTION3,OPTION4,ANSWER
1,Unto the pure allthings are pure: but unto them that are defiled and unbelieving is nothing pure; but even their mind and conscience id defiled.,TITUS 1:6,TITUS 1:14,TITUS 1:15,TITUS 1:16,3
2,"Put them in mind to be subject to principalities and powers, to obey magistrates, to be ready to every good work,",TITUS 3:1,TITUS 3:2,TITUS 3:3,TITUS 3:4,1
3,"To speak evil of no man, to be no brawlers, but gentle, shewing all meekness unto all men.",TITUS 3:1,TITUS 3:2,TITUS 3:3,TITUS 3:4,2
4,"Not by works of righteousness which we have done, but according to his mercy he saved us, by the washing of regeneration, and renewing of the Holy Ghost;",TITUS 3:5,TITUS 3:6,TITUS 3:8,TITUS 3:9,1
5,"This is a lawful saying, and these things I will that thou affirm constantly, that they which have believed in God might be careful to maintain good works. These things are good and profitable unto men.",TITUS 3:5,TITUS 3:6,TITUS 3:8,TITUS 3:9,3
6,"But avoid foolish questions, and genealogies, and contentions, and strivings about the law; for they are unprofitable and vain.",TITUS 3:5,TITUS 3:6,TITUS 3:8,TITUS 3:9,4